,Authors,Body,Keywords,Date
34,"['Corky Siemaszko', 'Corky Siemaszko Is A Senior Writer For Nbc News Digital.']","Some of Texas’ top doctors warned Wednesday that Gov. Greg Abbott’s sudden decision to ditch the mask mandate and lift coronavirus restrictions could result in a new surge of Covid-19 infections and deaths.

And while they now have enough masks, ventilators and emergency room space to treat a new wave of patients, they say there is an acute shortage of staffers who aren’t already stressed out and exhausted from battling the pandemic for more than a year.

“We have the capacity to take care of more patients,” Dr. James McDeavitt of the Baylor College of Medicine told NBC News. “We have an ample supply of PPE. That means a lot. The more difficult problem is that while many people in Texas experienced the pandemic in waves, there’s been no respite for front-line health care providers. The biggest issue now is morale. Many health care providers fear this could extend the pandemic.”

McDeavitt, the Houston hospital’s senior vice president and dean of clinical affairs, said he shares these fears.

“I think the governor’s decision was premature,” he said. “If the goal is to reach herd immunity, we are not there yet. Masking and distancing are an important bridge to herd immunity. We’re still seeing 1,000 new cases per day in Houston. We’re getting some 200 new Covid-19 patients per day in the hospitals. Yes, the numbers are down considerably, but that’s still pretty high.”

Houston Methodist President and CEO Dr. Marc Boom said the hardest thing for his exhausted staffers to swallow is the knowledge “that we are 90 to 120 days away from a much better situation.""

Full coverage of the coronavirus outbreak

“Our staff is tired and we’re still in the midst of a third surge,” he said. “Now, everybody is contemplating a fourth surge of infections.”

Why? Because last month’s freak winter storm, which knocked out power to much of the state, forced many Texans to abandon their homes and head to heated shelters where there was little, if any, social distancing.

“Give us 90 to 120 more days and the world will look a lot better,” Boom said. “Wearing a mask may not be mandated, but it’s a personal responsibility as the governor himself said. And we are urging people to continue wearing their masks.”

Both Boom and McDeavitt said that no matter what happens, thanks to the vaccines any new surge won’t be as bad as the prior waves of infections.

“As I said, I think the governor’s decision was premature and I think it will cause another surge,” McDeavitt said. “But I don’t think this is Armageddon. I don’t think this is the end of the world. There is a light at the end of the tunnel and it is getting closer.”

Abbott, a Republican who resisted imposing restrictions early on in the pandemic, surprised Texans on Tuesday by suddenly lifting the state’s mask mandate, rolling back many of the Covid-19 health guidelines, and declaring, “It is now time to open Texas 100 percent.”

That same day, Mississippi Gov. Tate Reeves announced that he was lifting his state’s mask mandate. He too is a Republican.

“We never attempted to say that we're trying to keep every single Mississippian from contracting the virus,” Reeves said Wednesday on Fox Business Network. “Our goal has always been to protect the integrity of our health care system such that if anyone gets the virus, if they can get better with quality care, that they receive that quality care.”

President Joe Biden called the moves by Abbott and Reeves examples of “Neanderthal thinking” and blasted both leaders for easing restrictions even after the federal Centers for Disease Control and Prevention warned against complacency in the face of emerging coronavirus variants.

""I think it's a big mistake,” Biden said Wednesday. “Look, I hope everybody realizes by now that masks make a big difference.”

Texas Attorney General Ken Paxton, however, praised Abbott and said the governor “has moved in the absolute right direction.”

“This is a pandemic that was going to spread one way or the other, and there are certainly things we can do to protect ourselves, but we can't protect everyone all the time, and it is going to spread to some degree,” Paxton said Wednesday on Fox News. “I just think it's time for individual responsibility as opposed to government oversight.”

Paxton, a Republican, is under FBI investigation for allegedly using his office to aid a wealthy political donor.

Dr. Matt Dacso, an internist at the University of Texas Medical Branch, told The Houston Chronicle that Abbott’s announcement hit him like an episode of post-traumatic stress disorder.

“I can think of no other word but incomprehensible,” he said. “Everybody is hurting, but gosh, man. The masks were doing a lot for us.”

San Antonio Mayor Ron Nirenberg said ditching the mask mandate while opening businesses at 100 percent capacity is a “huge mistake.”

“Covid-19 is still widespread in our community and infecting too many of our vulnerable residents,” he said in a statement Tuesday. “You don’t cut off your parachute just as you’ve slowed your descent.”

Download the NBC News app for full coverage of the coronavirus outbreak

Harris County Judge Lina Hidalgo noted that Abbott’s announcement came as Texas was trying to get vaccine distribution back on track after it was derailed by the deadly winter storm that knocked out power across much of the state. Abbott and the rest of the Republicans who run much of the state have gotten an earful from residents angry about the failure of the Texas power grid.

“With the arrival of Covid-19 vaccines, we’re inching closer to the finish line of this pandemic — now is not the time to reverse the gains we’ve worked so hard to achieve,” she said Tuesday. “At best, today’s decision is wishful thinking. At worst, it is a cynical attempt to distract Texans from the failures of state oversight of our power grid.”

In Mississippi, hospital administrators said they were ready for the worst.

“The easy answer is the governor’s announcement will not affect us,” said Marc Rolph, chief spokesman for the University of Mississippi Medical Center in Jackson. “We never let our guard down so there is no need for us to do any extra prep work. We know the governor’s decision increases the chance for another surge, but we’ve already been preparing for another surge.”","['power', 'mandate', 'care', 'greg', 'state', 'surge', 'think', 'decision', 'say', 'gov', 'scrap', 'pandemic', 'texas', 'mask', 'doctors', 'result']",2021-03-03 22:09:00+00:00
35,"['David K. Li', 'David K. Li Is A Breaking News Reporter For Nbc News.']","San Antonio Spurs coach Gregg Popovich blasted Gov. Greg Abbott on Tuesday for rescinding Texas' mask mandate and rolling back other Covid-19 restrictions, calling the decision ""mystifying,"" ""ridiculous"" and ""ignorant.""

Speaking to reporters before San Antonio's 119-92 victory over the New York Knicks, Popovich said that the coronavirus pandemic is still raging and that Abbott's actions defy science.

""I'm worried about the people in our state,"" said Popovich, who has led the Spurs to five NBA championships. ""That's a pretty mystifying decision considering the situation that we're all in.""

Popovich, an Air Force Academy graduate and former intelligence officer, has the third most regular-season coaching victories in pro basketball history. He's also been one of the most outspoken figures in American sports on issues of racial justice and gender equality.

Full coverage of the coronavirus outbreak

The Spurs coach said he's particularly concerned for business owners who want to keep customers and workers safe but will have no authority to tell patrons to wear masks.

""They're trying to do a good job of keeping everybody safe. Of course they want to open up. But getting rid of masks just seems ignorant to me,"" said Popovich, who will serve as Team USA's head basketball coach at the upcoming Olympics. ""People that didn't want to wear masks in the first place, how do the businesses get them to wear masks? Well, now they don't have to. So now there will be more infections, one would think.""

Abbott said Tuesday that his new executive order would rescind most of his previous Covid-19 executive orders and that all businesses would be allowed to open ""100 percent"" effective March 10.

A representative for Abbott could not immediately be reached for comment Wednesday.

While rates of infections are generally coming down across the U.S., thousands of people are still dying. As of Wednesday afternoon, nearly 14,000 people had died from Covid-19 over the previous seven days, according to data from the Centers for Disease Control and Prevention.

Texas still has one of the country's highest rates of infection, as more than 12.3 percent of coronavirus tests in the state came back positive over the last seven days, according to Johns Hopkins University data reported Wednesday. Public health officials have said local governments should use a 5 percent positivity rate as a benchmark to safely reopen.

""But when all of a sudden we act like it's over with, when all the science tells us the opposite, it's basically you're saying: 'You get inflected, you die, it's the way it goes. We got to open up,'"" Popovich said. ""That's not the way to do it. This is really ridiculous.""

Popovich said he fears that getting rid of mask mandates could lead to a surge in cases similar to the deadly fall and winter spike, which was linked to holiday travel and lax adherence to safeguards.

""It's like we have to have instant gratification,"" Popovich said. ""We already went through this once, and now we're going to do it again.""

Download the NBC News app for full coverage of the coronavirus outbreak

CDC Director Rochelle Walensky on Monday strongly cautioned against Abbott's rollbacks.

""Please hear me clearly,"" Walensky said. ""At this level of cases with variants spreading, we stand to completely lose the hard-earned ground we have gained.""

President Joe Biden echoed the concerns Tuesday, even as he announced that the U.S. will have enough Covid-19 vaccine doses for every adult by the end of May.

""This fight is far from over,"" Biden said. ""Though we celebrate the news ... I urge all Americans: Please keep washing your hands, stay socially distanced, wear masks.""","['mandates', 'walensky', 'masks', 'covid', 'wear', 'gregg', 'covid19', 'way', 'lifting', 'coach', 'coronavirus', 'slams', 'governor', 'open', 'popovich', 'texas', 'spurs', 'san']",2021-03-04 03:35:00+00:00
36,"['Lauren Egan', 'Lauren Egan Is A Reporter For Nbc News Based In Washington.']","WASHINGTON — President Joe Biden criticized the decisions in Texas and Mississippi to roll back statewide mask mandates and other Covid-19 health guidelines as ""Neanderthal thinking.""

""I think it's a big mistake. Look, I hope everybody realizes by now that masks make a big difference. We are on the cusp of being able to fundamentally change the nature of this disease because the way in which we are able to get vaccines,"" Biden told reporters.

""The last thing we need is the Neanderthal thinking that, in the meantime, everything is fine, take off our mask, forget it,"" he added.

Texas Gov. Greg Abbott announced Tuesday that it was ""now time to open Texas 100 percent,"" citing the economic impact of the virus. Shortly after Abbott's announcement, Mississippi Gov. Tate Reeves said that he would also end his state's mask mandate. Both governors are Republicans.

The governors' decision came just one day after the Centers for Disease Control and Prevention warned that relaxing the guidelines could cause cases to trend upward again.

Andy Slavitt, the White House senior adviser for Covid-19 response, said Wednesday that the Biden administration was ""using the absolute full extent of all of the areas where we have federal control"" to enforce health guidelines and that they were ""actively being very, very clear on what we think needs to happen.""

""We hope that other elected officials who have the authority in their domains will, in fact, listen,"" he said.

Biden said that the U.S. risks thousands of more deaths to Covid-19 if Americans drop basic guidelines to stop the spread, including masks and social distancing.

""It is critical, critical, critical that they follow the science,"" Biden said of the governors.

Biden announced Tuesday that the U.S. is expected to have enough doses of the three authorized Covid-19 vaccines for every American adult by the end of May, two months earlier than previous estimates. He credited the sped-up timeline to the administration's efforts to ramp up the production and distribution of the vaccine.","['mandates', 'guidelines', 'covid19', 'think', 'thinking', 'mississippi', 'neanderthal', 'lifting', 'biden', 'critical', 'criticizes', 'vaccines', 'texas', 'mask']",2021-03-03 20:11:00+00:00
37,['Associated Press'],"MEXICO CITY — Even as other countries institute airport testing, tracing and mandatory isolation, Mexican authorities bragged Wednesday about the speed with which they let tourists exit the terminal at the resort of Cancún.

Mexico’s National Immigration Institute, the INM, said Wednesday it took tourists an average of only one to two minutes to enter the country.

“The INM is working to maintain and offer rapid service, with quality and warmth,” the institute said.

During peak hours Tuesday, checkpoints at the Cancún airport processed almost 9,000 tourists arriving on dozens of flights.

Mexico has not recovered the level of tourism it had before the pandemic; the overall numbers of tourists arriving at the Cancún airport, one of Mexico’s busiest, was about 1.3 million in January, 54.7% lower than the same month of 2020, when almost 2.3 million passengers landed there.

But Mexico is one of the few nations in Latin America, and the world, to have instituted almost no measures to limit travelers, require mandatory testing or isolation upon arrival.

Passengers bound for Mexico just have to fill out a form asking about their risk factors for COVID-19 and their contact details.

International arrivals in Cancún took the biggest hit in January, but domestic arrivals of people boarding flights within Mexico to Cancún were down only about 18%.

Flights from the U.S. dried up last spring as the pandemic took hold but returned to near-normal during the holiday season. In December, Quintana Roo, the state where Cancún is located, was averaged 460 air arrivals and departures per day compared to a pre-pandemic average of 500. Tourism accounts for 87% of Quintana Roo’s gross domestic product.

Follow NBC Latino on Facebook, Twitter and Instagram.","['took', 'quintana', 'institute', 'airport', 'tourists', 'tourism', 'covid', 'lets', 'cancún', 'arrivals', 'speedily', 'testing', 'despite', 'mexico']",2021-03-04 15:12:44+00:00
38,['March'],IE 11 is not supported. For an optimal experience visit our site on another browser.,"['11', 'watch', 'starship', 'test', 'visit', 'supported', 'experience', 'explodes', 'optimal', 'browser', 'spacex', 'site', 'landing', 'minutes', 'launch']",
39,['March'],"The fertility industry has been hit hard with delays and interruptions over the last year, devastating those with hopes of growing a family. NBC’s Erin McLaughlin reports on their struggles and how patients can be proactive from home.","['nbcs', 'hopes', 'mclaughlin', 'reports', 'interruptions', 'struggles', 'patients', 'impacting', 'hit', 'pandemic', 'planning', 'ivf', 'proactive', 'family', 'industry']",
40,['March'],"Buckingham Palace is opening an investigation into allegations of bullying made against Meghan, Duchess of Sussex, by former staff. Meanwhile, in a new look at Prince Harry and Meghan’s upcoming interview with Oprah, the duchess makes a serious claim against the royal family. NBC’s Keir Simmons reports for TODAY.","['staff', 'simmons', 'prince', 'palace', 'claims', 'launches', 'reports', 'probe', 'bullying', 'today', 'markle', 'upcoming', 'meghan', 'royal', 'buckingham', 'sussex', 'serious', 'duchess']",
41,['March'],"Buckingham Palace said Thursday Prince Philip, the husband of Queen Elizabeth, has undergone a successful procedure for a pre-existing heart condition and will remain in the hospital for treatment, NBC’s Keir Simmons reports.","['treatment', 'procedure', 'prince', 'simmons', 'reports', 'preexisting', 'philip', 'heart', 'queen', 'successful', 'undergone', 'remain', 'undergoes']",
