,Authors,Body,Keywords,Date
13,['Lucy Bayly Is The Business Editor For Nbc News.'],"Around 745,000 people filed for unemployment benefits for the first time last week, underscoring how the labor market continues to be hammered by the pandemic and by restrictive measures to control spread of the coronavirus.

Economists had predicted the latest weekly initial jobless claims for the week ended Feb. 26 would total around 750,000. It's the 50th week in a row that total initial claims have been higher than the worst week of the Great Recession.

As they work on rebuilding the economy, Treasury Secretary Janet Yellen and Federal Reserve Chairman Jerome Powell have both stressed that ""nothing is more important"" than widespread vaccination. With 1 in 10 Americans now fully vaccinated, there are already signs that vaccination is having its intended effect, according to economists' surveys.

“The disproportionately large declines in cases and Covid-19 fatalities among residents of long-term care facilities, where 4.6 million residents and staff members have already been vaccinated, suggests that vaccinations are having significant real world benefits,” said Daan Struyven, senior economist at Goldman Sachs, in a report this week.

President Joe Biden said Tuesday the United States will have enough vaccines for every adult by the end of May, two months earlier than the administration had previously estimated, partly due to an agreement between Johnson & Johnson and Merck, who will assist with production.

For now, the pain of joblessness drags on. One year after the pandemic began, some 10 million Americans remain without work and a further 7 million have abandoned their search for work.

""This suggests it will take some time to re-employ all of these millions of Americans either unemployed or underemployed or have exited the workforce,"" said Mark Hamrick, senior economic analyst at Bankrate.

""Springtime for the economy appears to beckon in the months to follow, as more vaccinations are given, and many activities previously taken for granted eventually resume,"" Hamrick said. ""It is with that backdrop that consumers will feel freer to spend, including after possible passage of further federal stimulus legislation and $1,400 payments for many households.""

The closely watched monthly employment report from the Bureau of Labor Statistics is released on Friday, and is expected to show 210,000 jobs were added to the economy last month. January gained just 49,000 positions, in part because holiday gatherings led to an increase in coronavirus infections and more business restrictions.

On Wednesday, monthly jobs data from private payroll firm ADP showed the number of hirings rose less than expected, with just 117,000 jobs versus estimates of 205,000.","['vaccinated', 'week', 'vs', 'claims', '750000', '745000', 'jobless', 'million', 'expected', 'work', 'weekly', 'americans', 'vaccinations', 'jobs', 'vaccination', 'total', 'economy']",2021-03-04 13:33:00+00:00
14,"['Dareh Gregorian', 'Dareh Gregorian Is A Politics Reporter For Nbc News.']","For decades, New York Gov. Andrew Cuomo has maintained an iron grip on his public image, bolstered by the unflappable loyalty of longtime allies and the trepidation of his biggest political foes.

Wanting to show that he was in control of the coronavirus pandemic, he held daily news conferences that made him nationally famous in contrast to a floundering federal response. He wanted to show that he was in control of the state's biggest city, and he spent years belittling New York City's mayor to prove it. He even wrote a book touting his ""leadership lessons from the Covid-19 pandemic"" while case numbers were still climbing.

And on Wednesday, facing his worst political crisis, he tried to give the perception that he was in control of very serious allegations of sexual harassment and inappropriate behavior, even though it was far from clear that he really was.

He publicly apologized to the women who said he sexually harassed them while letting those who've been calling for his ouster know he's not planning on going anywhere.

""I'm not going to resign,"" he said at a news conference, his first public appearance since the allegations came out. The state, he said, needs him to be in charge.

""We have a full plate. We have Covid. We have recovery. We have rebuilding. We have a teetering New York City. We have a terrible financial picture. We have to do vaccines. So no, I'm going to do the job that people of the state elected me to do,"" he said.

Hank Sheinkopf, a veteran New York political strategist, said Cuomo's remarks Wednesday were designed to let his rivals know that he's still ""in control.""

""The message was to de Blasio and to his enemies overall — I'm not going easy, and time is on my side,"" Sheinkopf said, referring to New York City Mayor Bill de Blasio.

Cuomo, who is in his third term, has faced heat before, but nothing like the storm of controversies that have buffeted him in the past several weeks, which have prompted calls for his resignation from over a dozen Democratic state lawmakers, strong rebukes from even his closest allies and news that state legislative leaders would be stripping his emergency coronavirus powers.

Rebecca Katz, a progressive strategist who has worked for de Blasio and worked on actress Cynthia Nixon's 2018 run against the governor, said: ""Andrew Cuomo's never been under this kind of scrutiny. This is the first time his scandals are leading the news,"" which he's likely to be well aware of.

""Nobody follows Andrew Cuomo's press coverage more closely than Andrew Cuomo,"" Katz said.

Steven Greenberg, a pollster at Siena College, said, ""It's no understatement to say he's facing his toughest test as governor.""

His problems began in late January, when state Attorney General Letitia James' office issued a report that found that the state Health Department had underreported the Covid-19 death toll in nursing homes by as much as 50 percent. A top aide told Democratic legislators that Cuomo's administration took months to release data about the death toll among nursing home residents in part because of worries that the information was ""going to be used against us"" by the Trump administration.

Cuomo was then accused in mid-February of having threatened to ""destroy"" a Democratic lawmaker who had alleged that the administration ""covered up"" the numbers. Cuomo denied having threatened the outspoken Assembly member, Ron Kim, who was also calling for Cuomo's emergency pandemic powers to be revoked. Cuomo denied that there had been a cover-up, but he said the state should have moved more quickly to release information.

Over the past week, Cuomo has also been hit with allegations of sexual harassment by three women — two who had worked for his administration and one who said he had harassed her at a wedding.

The first woman, Lindsey Boylan, wrote in an essay on Medium that Cuomo had repeatedly made inappropriate comments, including one suggesting that they play strip poker, and that he had once given her an unwanted kiss on the lips. Cuomo's press secretary, Caitlin Girouard, called the allegations ""quite simply false.""

Another former aide, Charlotte Bennett, told The New York Times in an interview published Saturday that Cuomo had made several inappropriate remarks about her sex life, which she said she interpreted as an overture. Bennett, 25, has told NBC News that the Times report was accurate and declined to comment further.

Cuomo on Saturday denied having made advances to Bennett, but he acknowledged Wednesday: ""I acted in a way that made people feel uncomfortable. It was unintentional. And I truly and deeply apologize for it.

""I feel awful about it,"" he added. ""And frankly, I am embarrassed by it. And that's not easy to say. But that's the truth. But this is what I want you to know, and I want you to know this from me directly: I never touched anyone inappropriately.""

Another woman, Anna Ruch, 33, told The Times in an article published Monday that she felt ""uncomfortable and embarrassed"" when Cuomo, whom she had just met, placed his hands on her face and asked to kiss her at a wedding in 2019. The story included a photograph that appears to show the moment.

Cuomo said Wednesday: ""I didn't know I was making her uncomfortable at the time. I feel badly that I did.

""My usual custom is to kiss and to hug and make that gesture. I understand that sensitivities have changed and behavior has changed. And I get it, and I'm going to learn from it,"" he said.

That he's too friendly, however, is not the typical complaint about Cuomo.

""You reap what you sow. This is someone who's governed through fear and bullying — it works until it doesn't,"" political consultant Bradley Tusk said. ""When you stumble, the knives come out.""

Download the NBC News app for breaking news and politics

The bad press has taken a toll on Cuomo's approval ratings, which hit record highs during the early months of the pandemic, when viewers flocked to watch his calm and measured coronavirus briefings. A poll by Nexstar New York/Emerson College released Tuesday indicated that only 38 percent of New Yorkers approve of the job he's doing, while 48 percent disapprove.

Tusk said it's unclear at this point whether Cuomo will still try to accomplish what his late father, Gov. Mario Cuomo, couldn't — get elected to a fourth term.

""A week and a half ago, some would have been scared to run against him,"" Tusk said.

Sheinkopf said the attorney general's investigation could work to Cuomo's advantage in the short run, because it buys him time. The investigation is expected to last months, allowing Cuomo to focus on the coronavirus vaccine rollout and coming budget talks to rebuild his managerial image.

""His power is in the budget,"" Sheinkopf said. ""If there's a guy who can sit this out and win, it's Andrew Cuomo. But the problem is we don't know what else is coming.""","['pressure', 'hes', 'cuomos', 'fights', 'political', 'state', 'york', 'survival', 'mounts', 'going', 'told', 'knives', 'come', 'know', 'cuomo', 'andrew']",2021-03-04 02:23:00+00:00
15,"['Yasmine Salam', 'Yasmine Salam Is A News Associate For Nbc News Based In London.']","LONDON — Sunday evening had promised to be the main event.

But the week leading up to Prince Harry and Meghan's interview with the media mogul Oprah Winfrey has instead delivered daily episodes of royal drama in the shape of leaks, counterstatements and well-timed preview clips.

The latest saw Meghan, the Duchess of Sussex, accuse the royal family of ""perpetuating falsehoods"" about the couple in a 30-second excerpt from the hotly-anticipated interview that was released early Thursday.

""I don’t know how they could expect that after all of this time, we would still just be silent if there’s an active role that 'The Firm' is playing in perpetuating falsehoods about us,"" she tells Winfrey.

Buckingham Palace told NBC News it would not be commenting on the clip.

Using the name that the British royal family sometimes uses to describe itself, Meghan once again set the couple apart in comments that will likely further fuel the growing public rift.

The clip was released just hours after the palace said it would conduct an internal investigation into bullying allegations against Meghan that were published by a U.K. newspaper earlier this week.

""We are clearly very concerned about the allegations,"" the statement said, referring to the report in the Times newspaper, which quotes unnamed sources and contains details not independently verified by NBC News.

“The Duchess is saddened by this latest attack on her character,"" a spokesperson for Meghan and Harry said.

News of the bullying probe dominated front pages in the United Kingdom on Thursday, with headlines declaring ""all-out war at the palace"" and ""unhappy families.""

Local morning shows on radio and television were similarly dominated by the royal saga.

One popular radio station went so far as to pose the question of whether the couple should be allowed to remain British citizens.

Download the NBC News app for breaking news and politics

Harry and Meghan have made their issues with U.K. tabloids well-known over the past few years.

In an interview with the TV host James Corden last week, Harry, grandson of Queen Elizabeth II, said that Britain’s ""toxic"" press was one of the things that drove him to move his family to California last year to live a more independent life.

""It was a really difficult environment, as I think a lot of people saw. We all know what the British press can be like and it was destroying my mental health,"" he said.

The sprinkling of preview clips throughout the week may have been designed to build tension ahead of the interview, which is set to air on CBS on Sunday night.

And so they did.

But for a royal family accustomed to keeping matters private, the extraordinary public battle marks a notable break from tradition.

""The Sussexes appear to be going public about their experiences in an effort to take control of the narrative,"" Carolyn Harris, a royal expert and author based in Canada, said.

While royals have given many interviews before, she said, the decision to invite such public scrutiny on the tensions that have played out behind palace doors will have been ""controversial"" with the family.

""I think it's got to the point now where you can see that the gloves are off,"" Roya Nikkhah, a royal expert and Sunday Times correspondent, told BBC Radio on Thursday.

""There is so much ill will on both sides historically about what has happened that timing is just one small thing,"" she added.

The Sussexes finalized their split from the royal family last month a year after ""stepping back"" from public duties amid a tabloid onslaught, which Meghan's supporters say often veered into racist harassment and bullying.

The couple announced on Valentine's Day they were expecting their second child.

The Winfrey interview has been billed as an opportunity for the couple to speak candidly about their reasons for breaking from the family.

""If that comes with risks of losing things,"" Meghan says in the teaser clip released Thursday, ""I mean, there's a lot that's been lost already.""","['war', 'tensions', 'media', 'week', 'palace', 'interview', 'accuses', 'royal', 'couple', 'meghan', 'public', 'perpetuating', 'radio', 'erupt', 'family', 'released', 'falsehoods']",2021-03-04 16:56:00+00:00
16,[],"The third time appeared to be the charm for Elon Musk’s Starship rocket - until it wasn’t.

The latest heavy-duty launch vehicle prototype from SpaceX soared flawlessly into the sky in a high-altitude test blast-off on Wednesday from Boca Chica, Texas, then flew itself back to Earth to achieve the first upright landing for a Starship model.

But the triumph was short-lived. Listing slightly to one side as an automated fire-suppression system trained a stream of water on flames still burning at the base of the rocket, the spacecraft blew itself to pieces about eight minutes after touchdown.

It was the third such landing attempt to end in a fireball after an otherwise successful test flight for the Starship, being developed by SpaceX to carry humans and 100 tons of cargo on future missions to the moon and Mars.

Test flight of the Starship SN10 prototype at SpaceX's South Texas test facility near Boca Chica Village in Brownsville, Texas, on March 3, 2021. SpaceX / via AFP - Getty Images

For Musk, the billionaire SpaceX founder who also heads the electric carmaker Tesla, the outcome was mixed news.

The Starship SN10 came far closer to achieving a safe, vertical touchdown than two previous models - SN8 in December and SN9 in February. In a tweet responding to tempered congratulations from an admirer of his work, Musk replied, “RIP SN10, honorable discharge.”

The video feed provided by SpaceX on the company’s YouTube channel cut off moments after the landing. But separate fan feeds streamed over the same social media platform showed an explosion suddenly erupting at the base of the rocket, hurling the SN10 into the air before it crashed to the ground and became engulfed in flames.

The complete Starship rocket, which will stand 394-feet (120 metres) tall when mated with its super-heavy first-stage booster, is SpaceX’s next-generation fully reusable launch vehicle - the center of Musk’s ambitions to make human space travel more affordable and routine.

A first orbital Starship flight is planned for year’s end. Musk has said he intends to fly Japanese billionaire Yusaku Maezawa around the moon with the Starship in 2023.","['texas', 'musk', 'flight', 'starship', 'test', 'rocket', 'spacex', 'blows', 'landing', 'vehicle', 'nails', 'prototype', 'sn10']",2021-03-04 15:38:36+00:00
17,"['Wilson Wong', 'Wilson Wong Is A Breaking News Reporter With Nbc News.']","Chris Harrison, host of ABC's reality dating show ""The Bachelor,"" said Thursday that he ""made a mistake"" when he defended a current contestant's past racist behavior.

In an interview with ABC News' ""Good Morning America,"" Harrison addressed his comments defending ""Bachelor"" contestant Rachael Kirkconnell, whose old photos showed her attending an antebellum plantation-themed fraternity formal in 2018. She was also accused of liking a photo containing the Confederate flag.

""I am an imperfect man, I made a mistake and I own that,"" Harrison told ""GMA"" co-host Michael Strahan. ""I believe that mistake doesn't reflect who I am or what I stand for. I am committed to progress, not just for myself, also for the franchise.""

Harrison was embroiled in controversy last month after an interview on ""Extra"" with former ""Bachelorette"" Rachel Lindsay, where he appeared to defend Kirkconnell. Days after the interview, Harrison announced that he was ""stepping aside"" from his hosting duties for ""a period of time.""

In his interview with Lindsay, Harrison expressed sympathy for Kirkconnell and implied that the criticism directed against her was unfair because the photos were from the past. When Lindsay said it was not a good look that Kirkconnell had attended a party celebrating the antebellum South, Harrison said, “Well, Rachel, is it a good look in 2018? Or is it not a good look in 2021? Because there’s a big difference.”

""It's not a good look ever,"" Lindsay said in response. ""If I went to that party, what would I represent at that party?""

In his interview with Strahan, Harrison renounced his previous statements, saying that antebellum parties — which celebrate a time period in the South during which slavery was present — were not OK in the ""past, present, future.""

Lindsay deactivated her Instagram account after becoming the target of online harassment over her interview with Harrison.

Harrison pleaded with people to stop harassing Lindsay.

""I stand against all forms of racism, and I am deeply sorry to Rachel Lindsay and to the Black community,"" Harrison said. ""To anyone who is throwing hate towards Rachel Lindsay, please stop.""

As for his return to ""The Bachelor"" series, Harrison said he hoped to come back with a renewed sense of change.

""This franchise can be an important beacon of change,"" he said. ""I know that change is felt, not just by me, but by many others. And we are excited and willing to do the work to show that progress.""

In the meantime, Harrison said he was seeking guidance from a ""race educator and strategist,"" who is teaching him how to learn from this experience and move forward.

He added that his ""GMA"" interview was ""not the finish line.""

""There is much more work to be done,"" he said.","['speaks', 'bachelor', 'racism', 'amid', 'harrison', 'aside', 'interview', 'lindsay', 'good', 'look', 'past', 'chris', 'host', 'kirkconnell', 'mistake', 'controversy', 'rachel', 'stepping']",2021-03-04 16:13:00+00:00
