,Authors,Body,Keywords,Date
23,"['Robert Schlesinger', 'A Veteran Washington Journalist', 'Commentator', 'Is Co-Host Of The Bipodisan Podcast. He Is The Author Of']","Republicans have long declared their supposedly unwavering obeisance to the great invisible hand of the market; as former House GOP Leader Dick Armey liked to say, “Markets are smart; government is dumb.”

And yet several recent moments have made that commitment seem situational. Whether discussing Dr. Seuss, Mr. Potato Head, voting rights or Twitter, Republicans seem ill at ease with — or just ignorant of — the ways the mighty market actually functions.

Just witness the contrived hysteria about the fabricated “cancellation” of Dr. Seuss, the beloved children’s books author. Dr. Seuss Enterprises — the very profitable company which controls the estate of the late Theodor Seuss Geisel, the man behind the pen name — has decided of its own free will to stop publishing a half-dozen of his books because, the company told The Associated Press, they “portray people in ways that are hurtful and wrong,” deploying stereotypes about Black and Asian people in a manner that Seuss’s own estate thinks is offensive and inappropriate.

The Fox outrage machine revved itself to high dudgeon over how this private company has decided to conduct its business, bemoaning the Seussian scalp-taking; the GOP’s culture-war ambulance chasers quickly followed suit. “First, they outlaw Dr. Seuss” — mind you, Theodore Geisel died in 1991 and its his own estate taking this action — “and now they want to tell us what to say,” House Minority Leader Kevin McCarthy, R-Calif., said in a mendacious non sequitur while debating proposed election law reforms.

The GOP is trying to use the heavy hand of government to pick and choose who can be a consumer rather than responding to their will.

Sen. Marco Rubio, R-Fla., tweeted that the spurious Seuss-squelching — again, the company that owns the rights to his work is opting not to continue publishing a handful of them moving forward — will prompt history books to see this era as “an example of a depraved sociopolitical purge driven by hysteria and lunacy.”

Someone is demonstrating hysteria and lunacy, but it's not who Rubio suggests.

Let’s get some perspective here: Seuss Enterprises made $33 million last year, more than 650 million of his books have been sold around the world and they’re available in more than 100 countries. There is no significant move — and certainly not from Seuss Enterprises — to ban, burn or otherwise cancel Dr. Seuss. A private company has made a considered business decision by pulling a small fraction of the Seuss catalog (none among its top sellers).

Exactly why is this any of the business of the federal government? Surely Republicans, who supposedly believe the government should interfere in private business decisions as little as possible, don’t think the market should cease to work its infallible will; surely if Seuss Enterprises is erring and catering to a political correctness that nobody wants, market forces will correct it. (Of course, the right-wing cancel chorus isn’t holding its breath for that to happen; neither should you. Most people weren’t buying these particular books in the first place.)

Or take the tale of Mr. Potato Head, the brand of children’s toy under which both Mr. and Mrs. Potato Head dolls have long been marketed by Hasbro. Last week, Hasbro announced that this entire universe of toys will henceforth be marketed under the brand “Potato Head” — though the titular couple will still be “Mr.” and “Mrs.” — and conservatives lost their collective minds, including some on Capitol Hill, where some Republicans weren’t going to let facts get in the way of their feelings.

The right’s growing disillusionment with free markets might have to do with the markets’ drift away from the right.

Glenn Beck assessed the true import of the Seuss/Potato Head decisions in typically florid fashion: “Buy Mr. and Mrs. Potato Head because it's the end of an era,” he said Wednesday. “It is the end of freedom in America.”

But, again: If Hasbro thinks it makes more sense to sell a Mrs. Potato Head doll as part of a “Potato Head” brand, rather than a “Mr. Potato Head” brand — and it does — isn’t that a company’s right? And if the company’s wrong, the market will tell them, with no right-wing outrage machine trying to cancel their decision necessary.

So what’s going on?

Perhaps looking to voting rights can help sharpen the picture. In a Supreme Court hearing on Tuesday over whether a restrictive Arizona law unconstitutionally discriminates against minorities, Republican National Committee lawyer Michael Carvin told the court that striking down the law — making it easier to vote — would put the GOP “at a competitive disadvantage relative to Democrats.”

It was a startling if not surprising admission. Republicans have lost the presidential popular vote in seven of the last eight elections — or to put it another way, they have been losing political market share. But instead of adjusting their product (their candidates and policies) or how they sell it (their messaging), the GOP increasingly relies on government interference to maintain power, including the distortionary nature of the Electoral College and the U.S. Senate (which is evenly split despite the fact that Democrats represent 41 million more constituents), radical gerrymandering and restrictive voting laws, like Arizona’s.

Conservatives may not like which market forces companies respond to, but in a free market, that's not their call.

But it’s not just anti-democratic (or anti-Republican) to try to reduce the system’s responsiveness to the will of the people; it’s anti-market. The GOP is, in effect, trying to use the heavy hand of government to pick and choose who can be a consumer rather than responding to their will.

In other words, the right’s growing disillusionment with free markets might have to do with the markets’ drift away from the right.

Companies are taking a more holistic view of what factors drive their decisions. For instance, the Business Roundtable — hardly a bastion of AOC stans and Bernie bros — announced in 2019 that the purpose of a corporation extended beyond strict adherence to the bottom line and includes “all stakeholders — customers, employees, suppliers, communities and shareholders.”

Conservatives may not like which market forces companies respond to, but in a free market, that's not their call. But in a less free market, they believe, maybe it could be.

Which brings us to former president Donald Trump. Speaking to the Conservative Political Action Conference last weekend, he repeated his oft-made claim that social media is part of a giant conspiracy to censor and silence conservatives. “Republicans, conservatives must … repeal Section 230 liability protections,” Trump told the crowd, to extended cheers. (Section 230 actually protects internet companies from liability from lawsuits for what gets published by others on their platforms, not from what they remove; ending it would, ironically, result in more content being removed, not less.)

“And if the federal government refuses to act,” he said, “then every state in the union where we have the votes, which is a lot of them, Big Tech giants, like Twitter, Google and Facebook, should be punished with major sanctions whenever they silence conservative voices.”

Never mind that Facebook has long catered to conservatives or that it wasn’t conservatism that got Trump a lifetime Twitter ban but seditious, insurrectionist lies. Trump called for — and conservatives cheered — more regulation of and lawsuits against private companies based on their market-based business decisions, and for the limited-government party to unleash the power of federal and state governments to punish those companies for how they choose to conduct their businesses.

In a free market in which Twitter was making bad business decisions, users would punish it by switching to Parler or Gab. Most, of course, have not done that; the idea that most users want more abuse, more violent rhetoric or more conspiracy theories proliferating on their social platforms is absurd. So conservatives want to find a way for the government to force companies to feed it to us anyway.

In the end the biggest victim of cancel culture might just be conservative principles.","['war', 'free', 'seuss', 'business', 'fight', 'debate', 'republicans', 'head', 'mr', 'conservatives', 'market', 'cancel', 'companies', 'shows', 'potato', 'culture']",2021-03-03 20:20:00+00:00
24,"['Max Burns', 'Max Burns Is A Democratic Strategist', 'Founder Of Third Degree Strategies. Find Him On Twitter']","In 2016, Donald Trump stood alone in advocating his particular brand of nativism, bigotry and screw-your-feelings Twitter hot takes. Now that Trumpism has become the norm within the GOP, voters seem to be asking why they would again nominate a nationally unpopular standard-bearer instead of one of Trump’s more dynamic acolytes. Indeed, if this weekend’s Conservative Political Action Conference, or CPAC, made anything clear, it’s that Donald Trump may not last long as the standard-bearer of Trumpism.

The fracturing MAGA base is big trouble for the former president — and an opportunity for Trump proteges like Florida Gov. Ron DeSantis.

An overwhelming 95 percent of GOP activists at the event want a strong Trump-inspired national agenda going forward, according to a Washington Times/CPAC poll released during the event. And while CPAC attendees may represent an extreme fringe of the GOP, that fringe tracks with the broader party mood. A Morning Consult/Politico poll released just after Trump was acquitted in his second impeachment trial found 59 percent of Republicans still wanted him to play a “major role” in the GOP going forward.

But while the CPAC straw poll showed that Trump remains the first choice of these die-hard Republican activists, the margin should be way too narrow for the former president’s comfort. A full third of those polled (32 percent) said they didn’t think Trump should run for president in 2024 or were unsure that he should.

The fracturing MAGA base is big trouble for the former president — and an opportunity for Trump proteges like Florida Gov. Ron DeSantis. Trump received 55 percent of the straw poll vote to the governor’s second-place 21. Without Trump as an option, DeSantis won a dominant plurality of 43 percent.

Though there would have been no Trumpism without Trump, Republicans’ hesitation highlights the fact that Trumpism can go forward without him — and maybe would be more successful if it did, as Trumpism’s policy goals wouldn’t face the distracting circus of Trump himself.

For all of Trump’s bluster, he generally proved ineffective at creating durable policy change — with the exception of the federal bench with its lifetime appointments, though how those judges rule in any given case is far from certain. Trump himself proved so personally unpopular that the conservative mainstreaming of Trumpism couldn’t save his doomed 2020 campaign. And Trump will spend the next four years separated from the social media platforms and presidential podium that made him a constant presence in American life.

“I don’t think they believe that Trump will actually be a candidate in 2024,” Republican strategist Mac Stipanovich told The Orlando Sentinel of the candidates coming up behind him.

While Trump was almost certainly boosted by the American Conservative Union’s decision to host CPAC right on his Palm Beach doorstep — a conscious effort at a “Trump coronation,” according to former ACU chief Al Cardenas — that decision only underscored his weakness by revealing the relative strength of his would-be heirs, DeSantis in particular.

Though Sens. Josh Hawley of Missouri and Ted Cruz of Texas have tried to position themselves as the presumptive heir to the MAGA movement, CPAC voters left Florida unconvinced: When Trump was excluded as an option, Cruz garnered support from only 7 percent of those polled. Hawley drew only 3 percent, on par with Fox News host Tucker Carlson.

Trump’s biggest competitor, it turns out, is much closer to Mar-a-Lago. DeSantis, who cribbed Martin Luther King Jr.’s “I Have a Dream” speech in welcoming CPAC attendees to Florida’s “oasis of freedom,” also stands out as the runaway 2024 favorite among hard-line GOP voters (admittedly he was probably also boosted by local supporters at the convention).

With Trump removed from the CPAC survey, DeSantis easily lapped the field with a staggering 43 percent. His closest challenger, South Dakota Gov. Kristi Noem, barely broke double digits, at 11 percent. The sharp rise of the DeSantis movement complicates an already difficult electoral math for Trump, who would face the real risk of losing Florida — now his adopted home state — to a governor whose approval rating far outperforms not only Trump’s, but every other GOP elected official in Florida.

While CPAC represents only one flank of the enduring Republican base, it is a crucial one. An unknown portion of rank-and-file Republican voters left the party following the Capitol attacks, and that Great Defection had the perverse effect of strengthening far-right control of the party at a critical moment. With moderates fleeing and critical voices like Sens. Pat Toomey of Pennsylvania and Ben Sasse of Nebraska rebuked and censured by their state parties for supporting impeachment, MAGA advocates once stuck with Trump now have an overflowing buffet of ideologically aligned candidates from which to choose.

And given that his electoral defeat resulted in the former president facing an impeachment charge of inciting an insurrection, even the unrepentant Trump might have second thoughts about entering the 2024 race when candidates like DeSantis are actively transforming his movement into more concrete action. And Trump’s declining popularity indicates that what Republican voters find unpalatable is Trump himself.

DeSantis is positioned to burnish his conservative credentials in the upcoming state legislative session. A recent survey of Florida political experts — more than half of whom are Republicans and a quarter Democrats — expect DeSantis to come away from the session with big victories on red-meat GOP proposals like an anti-rioting bill targeting liberal groups like Black Lives Matter and new voter suppression legislation. With the votes to pass any legislation they want, DeSantis and Florida Republicans can credibly claim to be a more effective, less distracting version of Trump.

Trump will remain a vengeful voice within the GOP even if he forgos a third campaign for the White House. But having made their performative point in elevating Trump to the presidency in 2016, Republican voters may now want to prove that Trumpism can produce lasting policies that reshape American life. Unfortunately for a man who billed himself as a legendary dealmaker, Trump failed to enshrine his voters’ values into sweeping law, and that failure now has the movement he energized quietly weighing its options.","['voters', 'hes', 'cpac', 'gop', 'secure', 'trump', 'florida', 'trumpism', 'trumps', 'republicans', 'statue', 'desantis', 'position', 'max', 'implies', 'republican', 'isnt', 'king']",2021-03-03 17:27:00+00:00
25,"['Sakshi Venkatraman', 'Sakshi Venkatraman Writes For Nbc News.']","Anjana Rajamani was 12 years old the first time she tried to shave her face.

""This guy I had a crush on said my mustache was thicker than his in front of all my class,"" she said.

After crying in the bathroom of her Southern California middle school, she went home and shaved it off.

""I gave myself razor burn,"" said Rajamani, 22. ""I had pink marks in my mustache area for two weeks.""

For Desi women who grew up in mostly white schools, that story might be uncomfortably familiar. Young South Asians say their elementary and middle school years were characterized by a dominating feature: hair. Everywhere. Bushy unibrows, thick leg hair, upper lip fuzz and coarse locks made them feel othered — and ugly — when they were 12.

As conversations about beauty, self-love and internalized racism come to the forefront, brown women are confronting what that did to them. White society set the standard that their body hair and face hair wasn't beautiful, Desi women say. And after years of promoting plucking, shaving and threading, the beauty industry put bushy eyebrows back on trend. Exhausted by being beholden to a standard that disregards them, Desi women say they have no choice but to define beauty on their own terms.

From age 11, Sonali Krishnakumar remembers being told she had ""man legs,"" ""hairy knees,"" a mustache and bad eyebrows. The insecurities crept up in middle school, so she stopped wearing crop tops, and she wore long pants even in the summer and begged her mom to let her shave. Being hairy made her feel ""dirty,"" she said.

She recalls once spending three painstaking hours yanking out her thick leg hairs with her mom's epilator.

""Now I'm like, why did I do that to myself? Why did I put myself through that?"" said Krishnakumar, 19.

""It's one of those things you're never conscious of until a white person points it out,"" one woman said.

She has watched the standard of beauty evolve from the time she was a little girl. Back then, thin brows, straight hair and a smooth, hairless body were in fashion. She didn't fit the mold. The root of her insecurity, she said, was looking to the white girls in her class, whom she considered beautiful, and wondering why she didn't look like them.

South Asian women say the subtle comments and looks from peers growing up compounded what pop culture had ingrained into them — that they weren't beautiful. Samaa Khullar, 20, has never forgotten how biting some of the remarks were.

""I remember in middle school in the changing rooms for PE, girls would laugh about having dark underarms or dark hair,"" she said. ""You know, it's one of those things you're never conscious of until a white person points it out.""

Samaa Khullar as a child. Courtesy Samaa Khullar

Body hair standards as 'part of a white supremacist system'

Hair removal experts say the sentiment holds true when you look at the history of U.S. beauty standards. Hairlessness, after it became common in the 20th century, was synonymous with purity and white femininity.

""You can track patterns of anxiety about hygiene, beauty, personal care according to different migratory patterns to the U.S.,"" said Rebecca Herzig, a professor of gender and sexuality studies at Bates College in Maine and author of ""Plucked: A History of Hair Removal.""

In the late 19th century, when a wave of immigrants came to the U.S. from Southern and Eastern Europe, there was a parallel effort to medicalize and demonize excessive body hair, Herzig said. Immigrant women from those countries had different features and more body hair — and the modern beauty standard began to take shape as part of the anti-immigrant reaction. Similar personal hygiene and beauty anxieties rose when migrants came from Asia, including South Asians, in the early 20th century. The 1950s and the 1960s brought another rise in immigration from Asia and Latin America, and the popularity of hair removal shot up with it.

""You can see new anxieties about personal hygiene, personal care, personal beauty, all getting tangled up with ideas about whiteness and race more broadly,"" an expert said.

""You can see new anxieties about personal hygiene, personal care, personal beauty, all getting tangled up with ideas about whiteness and race more broadly,"" Herzig said. ""'How is whiteness going to be defined? How is it going to be maintained? Who is going to get the privileges associated with it?'""

Herzig said that in her research and interactions with South Asian women, she can see the depth of harm that has been caused.

""It's important to understand that it's part of a white supremacist system, that it's not just psychological, not just about women internalizing and being damaged from these harmful messages,"" she said. ""It's also that there's whole legal, economic and social structures supporting that psychological harm.""

She said the demonization is compounded for trans women of color who are shamed for having body hair and are often ostracized when they seek to have it removed professionally.

The mental health toll

Feeling ugly, othered and at the whim of white beauty standards takes a toll that can stick with you for a lifetime, said Yuki Yamazaki, a half-South Indian, half-Japanese psychotherapist specializing in Asian Americans and colorism.

""Within a white society, already being a South Asian is to feel other,"" she said. ""Either that's because of your name, the culture or religion you were raised in, the food that you eat. Body hair is just another.""

Feeling ostracized like that can be a trigger, Yamazaki said, and it can induce stress and anxiety in environments where you feel implicitly or overtly judged. Both U.S. and South Asian media can also contribute to those feelings.

""No one has to tell you that you're unattractive or ugly for you to feel like you're unattractive or ugly,"" she said. ""When you look on the TV, there's constantly things on how to remove body hair, how to shave, how to be smooth. Skin lightening stuff, too. The skin that you have and the stuff on top of it needs to be altered.""

Yamazaki said that it can be a lot to unpack but that a good place for people to start can be to look inward at their own body hair practices and ask: ""How is it helping? How is it making me feel better?"" With people leaving their homes much more infrequently, she said, her own South Asian friends contend with the question of how to survive without consistent hair removal.

""We have two competing societies at the very least, white society and South Asian society, that gives us all of this bias and shame,"" she said. ""We're born into these cultures. How do we want to unpack it? And how do we eventually want to move forward inside of it?""

When your 'ugly' eyebrows become a profitable trend

Herzig places eyebrows in a category of their own — eyebrow trends change with the wind, and eyebrows themselves are easy to alter. But as the early 2000s trend of razor-thin eyebrows gave way to the fluffy, bushy brows of the 2010s, Desi women find themselves playing catch-up, they say.

Khullar said she was itching for the moment her mom would let her get her brows done in eighth grade. She wanted to fit in, so she got them threaded thin like the white girls at school.

""Literally, like, probably a year and a half later, everyone's like, 'Taylor Hill's eyebrows are so beautiful, and we should be moving on to the thick eyebrow trend,'"" Khullar said. ""They're capitalizing and profiting off of our features that they told us were ugly.""

""Whatever you feel insecure about right now is going to change when white people change their opinions on it,"" one person said.

She wishes she could go back and tell her younger self to stop with the hair removal and just embrace her natural look.

""Whatever you feel insecure about right now is going to change when white people change their opinions on it,"" she said.

Sai Seshadri, 23, was diagnosed with polycystic ovarian syndrome, or PCOS, six years ago. It meant that her facial and body hair grew thicker even than the typical South Asian's, and she ""always had this feeling like I was being judged.""

Seshadri said that she was teased in elementary and middle school for her facial and body hair, especially by preteen boys, and that it made her hate the way she looked. The girls with ""fair skin, perfect eyebrows and blond hair"" were the pretty ones.

Sai Seshadri as a teenager. Courtesy Sai Seshadri

When she was 14, she started getting her eyebrows threaded and shaving her legs. As an adult, she looks back with sadness and says she's still working to shake the internalized racism and embrace herself. With thick eyebrows back in fashion, it frustrates her that she has to fill in her thin brow hair to get the coveted look.

""Now when it's attached to an Instagram influencer or a model, it's cool. It's amazing,"" she said. ""They make money off of it. And meanwhile, there's so many of us who are still recovering from how we felt about it when we were younger.""

She's being treated for PCOS, and she said her symptoms have greatly improved. But being a South Asian woman still means that body and facial hair is a part of her journey. In leaving her community and meeting new people, Seshadri said, she has been able to overcome some of the beauty ideals she aspired to as a child. Talking to other women of color has been an important part of her journey.

""It wasn't something with me,"" she said. ""A lot of people felt that way. We're all unlearning it together.""","['asian', 'desi', 'hair', 'feel', 'south', 'personal', 'challenging', 'white', 'racist', 'growing', 'eyebrows', 'body', 'women', 'standards', 'shamed', 'beauty']",2021-03-04 14:15:00+00:00
